{"$schema":"https://json-schema.org/draft/2020-12/schema","$id":"https://agensfield.dev/scriba/schemas/context.schema.json","title":"Scriba agent context","type":"object","additionalProperties":false,"required":["schemaVersion","generatedAt","sources","providers","events"],"properties":{"schemaVersion":{"const":"scriba.context.v2"},"generatedAt":{"type":"string","format":"date-time"},"sources":{"type":"array","items":{"$ref":"#/$defs/source"}},"providers":{"type":"array","items":{"$ref":"#/$defs/provider"}},"events":{"type":"array","items":{"$ref":"event.schema.json"}}},"$defs":{"accountId":{"type":"string","pattern":"^acct-[0-9a-f]{20}$"},"windowKey":{"enum":["primary.five_hour","primary.weekly","spark.five_hour","spark.weekly","review.five_hour","review.weekly","oauth_apps.weekly","sonnet.weekly","design.weekly","routines.weekly","extra.current"]},"provenance":{"type":"object","additionalProperties":false,"required":["source"],"properties":{"source":{"enum":["provider-api","status-cache","budget-current","budget-history","policy-store"]}}},"source":{"type":"object","additionalProperties":false,"required":["sourceId","kind","availability","provenance"],"properties":{"sourceId":{"type":"string","minLength":1},"kind":{"enum":["quota","budget","grants","policy-events"]},"availability":{"enum":["available","degraded","unavailable"]},"observedAt":{"type":"string","format":"date-time"},"generatedAt":{"type":"string","format":"date-time"},"ageMs":{"type":"integer","minimum":0},"stale":{"type":"boolean"},"provenance":{"type":"array","items":{"$ref":"#/$defs/provenance"},"minItems":1,"uniqueItems":true},"reasonCode":{"enum":["fresh","stale","missing","read_error","history_unavailable"]}}},"window":{"type":"object","additionalProperties":false,"required":["key","usedPercent","remainingPercentPoints","resetAt"],"properties":{"key":{"$ref":"#/$defs/windowKey"},"usedPercent":{"type":["number","null"],"minimum":0,"maximum":100},"remainingPercentPoints":{"type":["number","null"],"minimum":0,"maximum":100},"resetAt":{"anyOf":[{"type":"string","format":"date-time"},{"type":"null"}]}}},"budget":{"type":"object","additionalProperties":false,"required":["key","risk","confidence","reasons"],"properties":{"key":{"$ref":"#/$defs/windowKey"},"risk":{"enum":["unknown","low","elevated","high","critical"]},"confidence":{"enum":["none","low","medium","high"]},"reasons":{"type":"array","items":{"type":"string"},"uniqueItems":true}}},"grants":{"type":"object","additionalProperties":false,"required":["availableCount"],"properties":{"availableCount":{"type":"integer","minimum":0},"earliestExpiryAt":{"type":"string","format":"date-time"}}},"account":{"type":"object","additionalProperties":false,"required":["accountId","credentialsAvailable","windows","budgets","grants","sourceIds"],"properties":{"accountId":{"$ref":"#/$defs/accountId"},"alias":{"type":"string","pattern":"^[a-z0-9]+(?:-[a-z0-9]+)*$","maxLength":32},"credentialsAvailable":{"type":"boolean"},"windows":{"type":"array","items":{"$ref":"#/$defs/window"}},"budgets":{"type":"array","items":{"$ref":"#/$defs/budget"},"uniqueItems":true},"grants":{"$ref":"#/$defs/grants"},"sourceIds":{"type":"array","items":{"type":"string","minLength":1},"uniqueItems":true}}},"unattributed":{"type":"object","additionalProperties":false,"required":["windows","budgets","grants","sourceIds"],"properties":{"windows":{"type":"array","items":{"$ref":"#/$defs/window"}},"budgets":{"type":"array","items":{"$ref":"#/$defs/budget"},"uniqueItems":true},"grants":{"$ref":"#/$defs/grants"},"sourceIds":{"type":"array","items":{"type":"string","minLength":1},"uniqueItems":true}}},"provider":{"type":"object","additionalProperties":false,"required":["providerId","accounts"],"properties":{"providerId":{"enum":["codex","claude"]},"accounts":{"type":"array","items":{"$ref":"#/$defs/account"}},"unattributed":{"$ref":"#/$defs/unattributed"}}}}}
