{"events":[{"accountId":"acct-00000000000000000001","data":{"checkpointPercent":20,"remainingPercentPoints":20,"resetAt":"2026-07-19T09:00:00Z","usedPercent":80,"windowKey":"primary.weekly"},"detectedAt":"2026-07-12T11:55:00Z","id":"policy-event-1","kind":"remaining_checkpoint","providerId":"codex","schemaVersion":"scriba.event.v2"}],"generatedAt":"2026-07-12T12:00:00Z","providers":[{"accounts":[{"accountId":"acct-00000000000000000001","alias":"work","budgets":[{"confidence":"medium","key":"primary.weekly","reasons":["recent_estimate_available"],"risk":"low"}],"credentialsAvailable":true,"grants":{"availableCount":1,"earliestExpiryAt":"2026-08-12T09:00:00Z"},"sourceIds":["codex-quota","codex-budget","codex-grants","codex-policy-events"],"windows":[{"key":"primary.weekly","remainingPercentPoints":80,"resetAt":"2026-07-19T09:00:00Z","usedPercent":20}]}],"providerId":"codex"}],"schemaVersion":"scriba.context.v2","sources":[{"ageMs":300000,"availability":"available","kind":"quota","observedAt":"2026-07-12T11:55:00Z","provenance":[{"source":"provider-api"}],"sourceId":"codex-quota","stale":false},{"ageMs":300000,"availability":"available","generatedAt":"2026-07-12T12:00:00Z","kind":"budget","provenance":[{"source":"budget-current"},{"source":"budget-history"}],"sourceId":"codex-budget","stale":false},{"ageMs":300000,"availability":"available","kind":"grants","observedAt":"2026-07-12T11:55:00Z","provenance":[{"source":"provider-api"}],"sourceId":"codex-grants","stale":false},{"ageMs":300000,"availability":"available","kind":"policy-events","observedAt":"2026-07-12T11:55:00Z","provenance":[{"source":"policy-store"}],"sourceId":"codex-policy-events","stale":false}]}
